{
  "id": "igel",
  "title": "Igel",
  "language": "de",
  "grades": {
    "from": 3,
    "to": 4
  },
  "topic": "Igel: Nahrung und Nachwuchs",
  "source": {
    "title": "Igel – Klexikon – das Kinderlexikon",
    "url": "https://klexikon.zum.de/index.php?title=Igel&oldid=161750",
    "revision": "161750",
    "license": "CC BY-SA 4.0",
    "licenseUrl": "https://creativecommons.org/licenses/by-sa/4.0/deed.de",
    "authorsUrl": "https://klexikon.zum.de/index.php?title=Igel&action=history",
    "retrieved": "2026-10-18",
    "verified": true
  },
  "excerpt": [
    {
      "text": "Igel schlafen am Tag unter Laub und Ästen.",
      "section": "Wie leben unsere Igel und was fressen sie?"
    },
    {
      "text": "Sehr gerne fressen sie auch Schnecken, aber nur selten solche mit Gehäuse.",
      "section": "Wie leben unsere Igel und was fressen sie?"
    },
    {
      "text": "Deshalb sind Igel in einem Garten sehr nützlich.",
      "section": "Wie leben unsere Igel und was fressen sie?"
    },
    {
      "text": "Vom Frühling bis zum Sommer treffen sie sich zur Paarung.",
      "section": "Wie vermehren sich Igel?"
    },
    {
      "text": "Die Mutter trägt dann die Jungen fünf Wochen lang in ihrem Bauch.",
      "section": "Wie vermehren sich Igel?"
    },
    {
      "text": "Das können zwei bis zehn Babys sein.",
      "section": "Wie vermehren sich Igel?"
    },
    {
      "text": "Bei der Geburt sind sie taub und blind und haben ganz weiche Stacheln.",
      "section": "Wie vermehren sich Igel?"
    },
    {
      "text": "Sechs Wochen lang trinken sie Milch bei ihrer Mutter.",
      "section": "Wie vermehren sich Igel?"
    }
  ],
  "rendition": [
    {
      "sentence": [
        "Igel schlafen am Tag unter Laub und ",
        {
          "slot": "s1"
        },
        "."
      ],
      "evidence": {
        "quote": "Igel schlafen am Tag unter Laub und Ästen."
      }
    },
    {
      "sentence": [
        "Igel fressen sehr gern ",
        {
          "slot": "s2"
        },
        ", ",
        {
          "slot": "s3"
        },
        " nur selten solche mit Gehäuse."
      ],
      "evidence": {
        "quote": "Sehr gerne fressen sie auch Schnecken, aber nur selten solche mit Gehäuse."
      }
    },
    {
      "sentence": [
        "Darum sind Igel im Garten sehr ",
        {
          "slot": "s4"
        },
        "."
      ],
      "evidence": {
        "quote": "Deshalb sind Igel in einem Garten sehr nützlich."
      }
    },
    {
      "sentence": [
        "Im ",
        {
          "slot": "s5"
        },
        " und im Sommer treffen sich die Igel zur Paarung."
      ],
      "evidence": {
        "quote": "Vom Frühling bis zum Sommer treffen sie sich zur Paarung."
      }
    },
    {
      "sentence": [
        "Die Mutter trägt die Jungen ",
        {
          "slot": "s6"
        },
        " Wochen lang im Bauch."
      ],
      "evidence": {
        "quote": "Die Mutter trägt dann die Jungen fünf Wochen lang in ihrem Bauch."
      }
    },
    {
      "sentence": [
        "Es können ",
        {
          "slot": "s7"
        },
        " Babys sein."
      ],
      "evidence": {
        "quote": "Das können zwei bis zehn Babys sein."
      }
    },
    {
      "sentence": [
        "Bei der ",
        {
          "slot": "s8"
        },
        " sind die Jungen taub und blind. Ihre ",
        {
          "slot": "s8b"
        },
        " sind ganz weich."
      ],
      "evidence": {
        "quote": "Bei der Geburt sind sie taub und blind und haben ganz weiche Stacheln."
      }
    },
    {
      "sentence": [
        {
          "slot": "s9"
        },
        " Wochen lang trinken die Kleinen Milch bei ihrer ",
        {
          "slot": "s9b"
        },
        "."
      ],
      "evidence": {
        "quote": "Sechs Wochen lang trinken sie Milch bei ihrer Mutter."
      }
    }
  ],
  "slots": {
    "s1": {
      "correct": "Ästen",
      "variants": [
        {
          "text": "Steinen",
          "errorClass": "number_name_date",
          "basis": "comparison",
          "conspicuousness": 2,
          "explanation": "Im Original steht: „Igel schlafen am Tag unter Laub und Ästen.“ Igel schlafen unter Laub und Ästen, nicht unter Steinen.",
          "evidence": "Igel schlafen am Tag unter Laub und Ästen."
        },
        {
          "text": "Esten",
          "errorClass": "spelling_rule",
          "basis": "text",
          "conspicuousness": 2,
          "explanation": "Das Wort kommt von „Ast“. Darum schreibt man es mit „Ä“: Äste."
        }
      ]
    },
    "s2": {
      "correct": "Schnecken",
      "variants": [
        {
          "text": "Schneken",
          "errorClass": "spelling_rule",
          "basis": "text",
          "conspicuousness": 2,
          "explanation": "Nach dem kurzen „e“ steht „ck“: Schnecken. Das hörst du, wenn du das Wort langsam sprichst."
        }
      ]
    },
    "s3": {
      "correct": "aber",
      "variants": [
        {
          "text": "aber aber",
          "errorClass": "slip",
          "basis": "text",
          "conspicuousness": 1,
          "explanation": "Hier steht ein Wort doppelt. Solche Fehler passieren schnell beim Schreiben."
        }
      ]
    },
    "s4": {
      "correct": "nützlich",
      "variants": [
        {
          "text": "nüzlich",
          "errorClass": "spelling_rule",
          "basis": "text",
          "conspicuousness": 2,
          "explanation": "Das Wort kommt von „nutzen“. Nach dem kurzen „ü“ steht „tz“: nützlich."
        }
      ]
    },
    "s5": {
      "correct": "Frühling",
      "variants": [
        {
          "text": "Herbst",
          "errorClass": "number_name_date",
          "basis": "comparison",
          "conspicuousness": 2,
          "explanation": "Im Original steht: „Vom Frühling bis zum Sommer treffen sie sich zur Paarung.“ Die Paarung ist im Frühling und im Sommer.",
          "evidence": "Vom Frühling bis zum Sommer treffen sie sich zur Paarung."
        }
      ]
    },
    "s6": {
      "correct": "fünf",
      "variants": [
        {
          "text": "acht",
          "errorClass": "number_name_date",
          "basis": "comparison",
          "conspicuousness": 2,
          "explanation": "Im Original steht: „Die Mutter trägt dann die Jungen fünf Wochen lang in ihrem Bauch.“ Die Mutter trägt die Jungen fünf Wochen lang.",
          "evidence": "Die Mutter trägt dann die Jungen fünf Wochen lang in ihrem Bauch."
        }
      ]
    },
    "s7": {
      "correct": "zwei bis zehn",
      "variants": [
        {
          "text": "zwei bis zwanzig",
          "errorClass": "number_name_date",
          "basis": "comparison",
          "conspicuousness": 2,
          "explanation": "Im Original steht: „Das können zwei bis zehn Babys sein.“ Es sind höchstens zehn Babys.",
          "evidence": "Das können zwei bis zehn Babys sein.",
          "tolerance": 1
        }
      ]
    },
    "s8": {
      "correct": "Geburt",
      "variants": [
        {
          "text": "Geburt,",
          "errorClass": "punctuation",
          "basis": "text",
          "conspicuousness": 2,
          "explanation": "Vor „sind“ steht hier kein Komma. Der Satz hat nur eine Aussage."
        }
      ]
    },
    "s8b": {
      "correct": "Stacheln",
      "variants": [
        {
          "text": "Stachlen",
          "errorClass": "slip",
          "basis": "text",
          "conspicuousness": 2,
          "explanation": "Zwei Buchstaben sind vertauscht: Stacheln."
        }
      ]
    },
    "s9": {
      "correct": "Sechs",
      "variants": [
        {
          "text": "Zehn",
          "errorClass": "number_name_date",
          "basis": "comparison",
          "conspicuousness": 2,
          "explanation": "Im Original steht: „Sechs Wochen lang trinken sie Milch bei ihrer Mutter.“ Es sind sechs Wochen.",
          "evidence": "Sechs Wochen lang trinken sie Milch bei ihrer Mutter."
        }
      ]
    },
    "s9b": {
      "correct": "Mutter",
      "variants": [
        {
          "text": "Muter",
          "errorClass": "spelling_rule",
          "basis": "text",
          "conspicuousness": 2,
          "explanation": "Nach dem kurzen „u“ steht „tt“: Mutter. Das Wort hat zwei „t“."
        }
      ]
    }
  },
  "notes": [
    "Quelle gelesen: Klexikon-Artikel Igel, Revision 161750 (abgerufen am 18.10.2026, Abschnitte „Wie leben unsere Igel und was fressen sie?“ und „Wie vermehren sich Igel?“); die acht Auszugssätze stehen wörtlich im abgerufenen Artikeltext (per Skript geprüft).",
    "Lizenz: Das Klexikon kennzeichnet seine Seiten im Fuß mit dem Logo CC BY-SA und verlinkt https://creativecommons.org/licenses/by-sa/4.0/deed.de; die Daten dieses Pakets stehen unter derselben Lizenz.",
    "Nur Klassen, die ab Klasse 3 vorkommen: Rechtschreibung (Ableitung, Doppelkonsonant, tz, ck), Flüchtigkeitsfehler, Zeichensetzung, Zahl/Ort. Die Falschschreibungen sind konstruiert, nach den Schwerpunkten der IQB-Handreichung.",
    "Nicht geprüft: ob der Artikeltext fachlich vollständig stimmt.",
    "Keine lokale PDF der Quelle."
  ]
}
